{
  "request_id": "REQ-001",
  "original_request": "请把上个月收到的用户问题整理一下，下周评审时用。",
  "objective": "整理用户问题",
  "source": null,
  "time_range_text": "上个月",
  "time_range": null,
  "usage_context": "下周评审",
  "expected_output": null,
  "due_date": null,
  "owner": null,
  "reviewer": null,
  "acceptance_criteria": [],
  "confidentiality": "PUBLIC_DEMO",
  "confirmed_by": null,
  "field_provenance": {
    "objective": "SOURCE_TEXT",
    "time_range_text": "SOURCE_TEXT",
    "usage_context": "SOURCE_TEXT"
  },
  "status": "NEEDS_CLARIFICATION"
}
